{
  "$schema": "./schema.json",
  "version": "1.0.0",
  "name": "Abashoverse Token List",
  "description": "Verified tokens and collections for the Abashoverse ecosystem on Abstract chain",
  "chains": {
    "2741": {
      "name": "Abstract",
      "type": "mainnet"
    },
    "11124": {
      "name": "Abstract Testnet",
      "type": "testnet"
    }
  },
  "tokens": [
    {
      "chainId": 11124,
      "address": "0x0000000000000000000000000000000000000000",
      "symbol": "ETH",
      "name": "Ether",
      "decimals": 18,
      "verified": true,
      "tags": ["native"],
      "logoURI": "icons/0x0000000000000000000000000000000000000000.svg"
    },
    {
      "chainId": 11124,
      "address": "0xb1488f753521c58f2ddfaf99b503c48aa14dfabe",
      "symbol": "MOCK2",
      "name": "Mock2",
      "decimals": 18,
      "verified": true,
      "tags": ["testnet", "mock"],
      "logoURI": "icons/0xb1488f753521c58f2ddfaf99b503c48aa14dfabe.svg"
    }
  ],
  "collections": [
    {
      "id": "abashoverse-verified",
      "name": "Abashoverse Verified",
      "description": "Tokens verified by the Abashoverse team",
      "tokens": [
        "0x0000000000000000000000000000000000000000",
        "0xb1488f753521c58f2ddfaf99b503c48aa14dfabe"
      ]
    },
    {
      "id": "stablecoins",
      "name": "Stablecoins",
      "description": "USD-pegged stablecoins",
      "tokens": []
    },
    {
      "id": "defi",
      "name": "DeFi Tokens",
      "description": "Tokens used in DeFi protocols",
      "tokens": []
    }
  ]
}
